{
  "schema_version": "0.2",
  "protocol_version": "PILOT_PROTOCOL_V0.2",
  "run_id": "CAL-9999-DR01",
  "plan_id": "CAL-9999-QP01",
  "scope_id": "CAL-9999-S01",
  "cohort_role": "blind_measurement_calibration",
  "substantive_use_allowed": false,
  "investigator": {
    "investigator_id": "fixture-reader",
    "execution_mode": "single_investigator_progressive_ladder",
    "prior_target_retrieval_exposure": false,
    "second_reader_status": "pending"
  },
  "environment": [
    {
      "platform": "GOOGLE_WEB",
      "observed_at": "2026-08-11T07:00:00+09:00",
      "account_state": "unknown",
      "ui_language": "ko",
      "location_basis": "unknown",
      "personalization_request": "pws=0",
      "notes": "Synthetic validator fixture."
    }
  ],
  "stabilization_contract": {
    "probe_interval_ms": 1000,
    "stable_probe_count": 2,
    "max_stabilization_ms": 8000
  },
  "budget_cells": [
    {
      "budget_cell_id": "GOOGLE_WEB-K0-CAL-9999",
      "platform": "GOOGLE_WEB",
      "knowledge_regime": "K0",
      "bay_or_site_id": "CAL-9999",
      "max_active_review_seconds": 120,
      "started_at": "2026-08-11T07:00:02+09:00",
      "ended_at": "2026-08-11T07:00:10+09:00",
      "active_review_seconds": 6,
      "network_wait_seconds": 2,
      "status": "within_budget",
      "query_ids": ["T-G-K0-01"],
      "pause_events": [],
      "contiguous_execution": true
    }
  ],
  "queries": [
    {
      "query_id": "T-G-K0-01",
      "order": 1,
      "platform": "GOOGLE_WEB",
      "knowledge_regime": "K0",
      "bay_id": null,
      "budget_cell_id": "GOOGLE_WEB-K0-CAL-9999",
      "planned_query": "\"테스트로 1\" 2015",
      "submitted_query": "\"테스트로 1\" 2015",
      "returned_query": "\"테스트로 1\" 2015",
      "suggested_rewrite": null,
      "suggestion_followed": false,
      "fallback_shown": false,
      "match_behavior": "exact",
      "timing": {
        "navigation_started_at": "2026-08-11T07:00:00+09:00",
        "first_probe_at": "2026-08-11T07:00:01+09:00",
        "terminal_state_at": "2026-08-11T07:00:02.200+09:00",
        "ended_at": "2026-08-11T07:00:10+09:00",
        "stabilization_elapsed_ms": 2200,
        "network_wait_seconds": 2.2,
        "active_review_seconds": 6
      },
      "terminal_page_state": "usable_results",
      "stabilization_observations": [
        {
          "probe_index": 1,
          "observed_at": "2026-08-11T07:00:01+09:00",
          "visible_title_count": 1,
          "explicit_no_results_signal": false,
          "fallback_signal": false,
          "blocked_signal": false,
          "returned_query": "\"테스트로 1\" 2015"
        },
        {
          "probe_index": 2,
          "observed_at": "2026-08-11T07:00:02.200+09:00",
          "visible_title_count": 1,
          "explicit_no_results_signal": false,
          "fallback_signal": false,
          "blocked_signal": false,
          "returned_query": "\"테스트로 1\" 2015"
        }
      ],
      "modules": [
        {
          "module_id": "T-G-K0-01-M01",
          "module_type": "GOOGLE_ORGANIC_WEB",
          "module_screen_order": 1,
          "rank_system": "GOOGLE_ORGANIC_RANK",
          "outcome_eligible": true,
          "results": [
            {
              "result_id": "T-G-K0-01-R01",
              "position": 1,
              "title": "합성 검증 결과",
              "url": "https://example.invalid/result",
              "snippet_excerpt": "실제 검색자료가 아닌 schema fixture다.",
              "privacy_transform": "none_needed",
              "displayed_date": null,
              "query_term_presence": {
                "name_or_category_term": "not_applicable",
                "location_term": "present",
                "time_term": "absent"
              },
              "disposition": "site_only_not_target_bay",
              "false_positive_types": ["same_address_other_business"],
              "identity_anchors": [],
              "independence_group": "synthetic-fixture",
              "candidate_clicked": false,
              "notes": "Synthetic record."
            }
          ]
        }
      ],
      "aggregate_outcome": {
        "search_surface_retrieval_hit": "not_found_under_protocol",
        "entity_location_match": "no",
        "historical_time_anchor": "none",
        "current_place_listing_match": "not_assessed",
        "identity_status": "unknown",
        "false_positive_types": ["same_address_other_business"]
      },
      "cross_bay_exposure": [],
      "notes": "Synthetic record."
    }
  ],
  "bay_outcomes": [
    {
      "bay_id": "CAL-9999-B01",
      "search_surface_retrieval_hit": "not_found_under_protocol",
      "entity_location_match": "no",
      "historical_time_anchor": "none",
      "current_place_listing_match": "not_assessed",
      "identity_status": "unknown",
      "identity_anchors": [],
      "material_conflicts": [],
      "false_positive_types": ["same_address_other_business"],
      "claim_boundary": "Synthetic validator fixture only."
    }
  ],
  "deviations": [],
  "privacy_audit": {
    "fixture_version": "0.2",
    "pre_storage_filter_applied": true,
    "post_serialization_scan_applied": true,
    "raw_dom_export_created": false,
    "sensitive_snippets_suppressed": 0,
    "phone_like_strings_remaining": 0,
    "email_like_strings_remaining": 0,
    "status": "pass"
  },
  "run_status": "SINGLE_READER_PASS_SECOND_READER_PENDING",
  "claim_boundary": [
    "Synthetic validator fixture; no empirical claim."
  ]
}
